{
  "id": "gts.frontx.uikit.meta.component.v1~frontx.uikit.component.accordion.v1",
  "gts_type": "gts.frontx.uikit.meta.component.v1~",
  "metamodel": "1.0.0",
  "component": "accordion",
  "props_schema": "gts.frontx.uikit.base.component.v1~frontx.uikit.component.accordion.v1~",
  "host_element": "gts.frontx.uikit.element.dom_div.v1~"
}
